{
  "schema_version": "1.0",
  "message_type": "annotation",
  "created_at": "2026-07-18T10:01:00Z",
  "safety_flags": {
    "synthetic_local_only": true,
    "mock_only": true,
    "dry_run": true,
    "owner_review_required": true,
    "external_side_effects_allowed": false,
    "external_side_effects_occurred": false,
    "blackboard_write_allowed": false,
    "queue_write_allowed": false,
    "audit_trail_write_allowed": false,
    "worker_dispatch_allowed": false,
    "openclaw_call_allowed": false,
    "hermes_runtime_allowed": false,
    "connector_call_allowed": false,
    "google_sheets_write_allowed": false,
    "follow_up_allowed": false,
    "follow_up_requires_owner_confirmation": true
  },
  "prev_entry_hash": "aaaaaaaaaaaaaaaaaaaaaaaaaaaaaaaaaaaaaaaaaaaaaaaaaaaaaaaaaaaaaaaa",
  "execution_class": "AUTO",
  "produced_by": "annotation-preview",
  "parent_task_id": null,
  "role": "annotator",
  "annotation_id": "annotation-phase3-001",
  "task_id": "task-phase3-001",
  "annotation_type": "safety",
  "annotation_status": "validated_preview",
  "display_title": "Read-only query annotation",
  "display_summary": "The draft grants no execution permission.",
  "allowed_behaviors": [
    "derive display-only safety information"
  ],
  "forbidden_behaviors": [
    "dispatch a worker",
    "call a real OpenClaw runtime"
  ],
  "safety_notes": [
    "Synthetic local-only record.",
    "Owner review remains required."
  ],
  "related_result_id": null,
  "next_owner_action": "Review the annotation before a decision preview."
}
